ID,Nome,Tipo,Sub-Tipo,Local,Imagem,Descrição,Interconexão 1,Interconexão 2,Interconexão 3,Interconexão 4,Interconexão 5,Interconexão 6,Interconexão 7,Interconexão 8,Interconexão 9,Interconexão 10,Interconexão 11,Interconexão 12,Interconexão 13,Interconexão 14,Interconexão 15,Dados consolidados,Fonte da descrição
CH-0399,INCRA,Local,Instituição,Aflitos,,"Incra é uma instituição localizada em Aflitos, no Recife/Pernambuco. Sua presença na base indica a importância das instituições públicas, assistenciais, administrativas ou de saúde na organização da vida urbana de Pernambuco. O registro aparece associado a Moura Cavalcanti, permitindo observar como serviços, órgãos e edifícios institucionais estruturam bairros, fluxos e memórias coletivas. funciona como ponto de ligação entre gestão pública, cotidiano urbano e história social.",Moura Cavalcanti,,,,,,,,,,,,,,,"CH-0399 — INCRA
Classificação: Local / Instituição / Aflitos
Descrição: Incra é uma instituição localizada em Aflitos, no Recife/Pernambuco. Sua presença na base indica a importância das instituições públicas, assistenciais, administrativas ou de saúde na organização da vida urbana de Pernambuco. O registro aparece associado a Moura Cavalcanti, permitindo observar como serviços, órgãos e edifícios institucionais estruturam bairros, fluxos e memórias coletivas. funciona como ponto de ligação entre gestão pública, cotidiano urbano e história social.
Interconexões: Moura Cavalcanti",https://antonioaurel.github.io/data/data-visualization/recife-history-connections/pages/sources.html
CH-0400,Terminal de Passageiros,Local,Estação de Transporte Público,Recife Antigo,,"Terminal de Passageiros é uma estação de transporte público situada no Recife/Pernambuco. Relaciona-se a Moura Cavalcanti, indicando sua função como ponto de articulação entre território, memória e vida urbana. Sua presença ajuda a compreender como espaços públicos, edifícios, instituições e equipamentos acumulam camadas de uso social, homenagens e transformações ao longo do tempo. Terminal de Passageiros funciona como referência para compreender a experiência cotidiana do Recife com processos históricos, culturais e políticos mais amplos.",Moura Cavalcanti,,,,,,,,,,,,,,,"CH-0400 — Terminal de Passageiros
Classificação: Local / Estação de Transporte Público / Recife Antigo
Descrição: Terminal de Passageiros é uma estação de transporte público situada no Recife/Pernambuco. Relaciona-se a Moura Cavalcanti, indicando sua função como ponto de articulação entre território, memória e vida urbana. Sua presença ajuda a compreender como espaços públicos, edifícios, instituições e equipamentos acumulam camadas de uso social, homenagens e transformações ao longo do tempo. Terminal de Passageiros funciona como referência para compreender a experiência cotidiana do Recife com processos históricos, culturais e políticos mais amplos.
Interconexões: Moura Cavalcanti",https://antonioaurel.github.io/data/data-visualization/recife-history-connections/pages/sources.html
CH-0401,Faculdade Maurício de Nassau,Local,Universidade,Graças,,"Faculdade Mauricio de Nassau é uma universidade localizada em Graças, no Recife/Pernambuco. O espaço se relaciona à formação cultural, educacional ou artística de Pernambuco e ajuda a preservar memórias, práticas e experiências coletivas. aparece associado a Ponte da Capunga, indicando sua função como registro de conhecimento, sociabilidade e produção cultural. o registro aproxima educação, patrimônio, cultura urbana e trajetórias históricas que atravessam a cidade.",Ponte da Capunga,,,,,,,,,,,,,,,"CH-0401 — Faculdade Maurício de Nassau
Classificação: Local / Universidade / Graças
Descrição: Faculdade Mauricio de Nassau é uma universidade localizada em Graças, no Recife/Pernambuco. O espaço se relaciona à formação cultural, educacional ou artística de Pernambuco e ajuda a preservar memórias, práticas e experiências coletivas. aparece associado a Ponte da Capunga, indicando sua função como registro de conhecimento, sociabilidade e produção cultural. o registro aproxima educação, patrimônio, cultura urbana e trajetórias históricas que atravessam a cidade.
Interconexões: Ponte da Capunga",https://antonioaurel.github.io/data/data-visualization/recife-history-connections/pages/sources.html
CH-0402,Estrada do Arraial,Local,Logradouro,Casa Amarela,,"Estrada do Arraial é um logradouro localizado em Casa Amarela, no Recife/Pernambuco. Como via urbana, ajuda a compreender a circulação, a ocupação dos bairros e a permanência de homenagens na paisagem da cidade. aparece associado a Sitio da Trindade, indicando sua função como ponto de ligação entre território, memória e vida cotidiana. o registro permite observar como nomes de ruas e avenidas conectam personagens, instituições, eventos e transformações do Recife ao longo do tempo.",Sítio da Trindade,,,,,,,,,,,,,,,"CH-0402 — Estrada do Arraial
Classificação: Local / Logradouro / Casa Amarela
Descrição: Estrada do Arraial é um logradouro localizado em Casa Amarela, no Recife/Pernambuco. Como via urbana, ajuda a compreender a circulação, a ocupação dos bairros e a permanência de homenagens na paisagem da cidade. aparece associado a Sitio da Trindade, indicando sua função como ponto de ligação entre território, memória e vida cotidiana. o registro permite observar como nomes de ruas e avenidas conectam personagens, instituições, eventos e transformações do Recife ao longo do tempo.
Interconexões: Sítio da Trindade",https://antonioaurel.github.io/data/data-visualization/recife-history-connections/pages/sources.html
CH-0403,Visconde de Suassuna,Personagem,,,,"Francisco de Paula Cavalcanti de Albuquerque, o Visconde de Suassuna, foi militar e político pernambucano ligado à elite provincial do século XIX. Sua memória permanece na cidade por meio da Avenida Visconde de Suassuna, importante logradouro da Boa Vista. conecta-se ao Cemitério de Santo Amaro e à própria avenida, articulando biografia política, homenagens urbanas e a permanência de nomes do período imperial na paisagem do Recife.",Avenida Visconde de Suassuna,,,,,,,,,,,,,,,"CH-0403 — Visconde de Suassuna
Classificação: Personagem
Descrição: Francisco de Paula Cavalcanti de Albuquerque, o Visconde de Suassuna, foi militar e político pernambucano ligado à elite provincial do século XIX. Sua memória permanece na cidade por meio da Avenida Visconde de Suassuna, importante logradouro da Boa Vista. conecta-se ao Cemitério de Santo Amaro e à própria avenida, articulando biografia política, homenagens urbanas e a permanência de nomes do período imperial na paisagem do Recife.
Interconexões: Avenida Visconde de Suassuna",https://antonioaurel.github.io/data/data-visualization/recife-history-connections/pages/sources.html
CH-0404,Monte dos Guararapes,Local,Sítio Histórico,Jaboatão,,"Monte dos Guararapes é um sitio histórico localizado em Jaboatão, no Recife/Pernambuco. Relaciona-se a Batalha dos Guararapes, indicando sua função como ponto de articulação entre território, memória e vida urbana. Sua presença ajuda a compreender como espaços públicos, edifícios, instituições e equipamentos acumulam camadas de uso social, homenagens e transformações ao longo do tempo. Monte dos Guararapes funciona como referência para compreender a experiência cotidiana do Recife com processos históricos, culturais e políticos mais amplos.",Batalha dos Guararapes,,,,,,,,,,,,,,,"CH-0404 — Monte dos Guararapes
Classificação: Local / Sítio Histórico / Jaboatão
Descrição: Monte dos Guararapes é um sitio histórico localizado em Jaboatão, no Recife/Pernambuco. Relaciona-se a Batalha dos Guararapes, indicando sua função como ponto de articulação entre território, memória e vida urbana. Sua presença ajuda a compreender como espaços públicos, edifícios, instituições e equipamentos acumulam camadas de uso social, homenagens e transformações ao longo do tempo. Monte dos Guararapes funciona como referência para compreender a experiência cotidiana do Recife com processos históricos, culturais e políticos mais amplos.
Interconexões: Batalha dos Guararapes",https://antonioaurel.github.io/data/data-visualization/recife-history-connections/pages/sources.html
CH-0405,Rua Gervásio Pires,Local,Logradouro,Boa Vista,,"Rua Gervásio Pires é um logradouro localizado em Boa Vista, no Recife/Pernambuco. Como via urbana, ajuda a compreender a circulação, a ocupação dos bairros e a permanência de homenagens na paisagem da cidade. aparece associado a Gervásio Pires, indicando sua função como ponto de ligação entre território, memória e vida cotidiana. o registro permite observar como nomes de ruas e avenidas conectam personagens, instituições, eventos e transformações do Recife ao longo do tempo.",Gervásio Pires,,,,,,,,,,,,,,,"CH-0405 — Rua Gervásio Pires
Classificação: Local / Logradouro / Boa Vista
Descrição: Rua Gervásio Pires é um logradouro localizado em Boa Vista, no Recife/Pernambuco. Como via urbana, ajuda a compreender a circulação, a ocupação dos bairros e a permanência de homenagens na paisagem da cidade. aparece associado a Gervásio Pires, indicando sua função como ponto de ligação entre território, memória e vida cotidiana. o registro permite observar como nomes de ruas e avenidas conectam personagens, instituições, eventos e transformações do Recife ao longo do tempo.
Interconexões: Gervásio Pires",https://antonioaurel.github.io/data/data-visualization/recife-history-connections/pages/sources.html
CH-0406,Rua Henrique Dias,Local,Logradouro,Boa Vista,,"Rua Henrique Dias é um logradouro localizado em Boa Vista, no Recife/Pernambuco. Como via urbana, ajuda a compreender a circulação, a ocupação dos bairros e a permanência de homenagens na paisagem da cidade. aparece associado a Henrique Dias e Fundação Joaquim Nabuco, indicando sua função como ponto de ligação entre território, memória e vida cotidiana. o registro permite observar como nomes de ruas e avenidas conectam personagens, instituições, eventos e transformações do Recife ao longo do tempo.",Henrique Dias,Fundação Joaquim Nabuco,,,,,,,,,,,,,,"CH-0406 — Rua Henrique Dias
Classificação: Local / Logradouro / Boa Vista
Descrição: Rua Henrique Dias é um logradouro localizado em Boa Vista, no Recife/Pernambuco. Como via urbana, ajuda a compreender a circulação, a ocupação dos bairros e a permanência de homenagens na paisagem da cidade. aparece associado a Henrique Dias e Fundação Joaquim Nabuco, indicando sua função como ponto de ligação entre território, memória e vida cotidiana. o registro permite observar como nomes de ruas e avenidas conectam personagens, instituições, eventos e transformações do Recife ao longo do tempo.
Interconexões: Henrique Dias; Fundação Joaquim Nabuco",https://antonioaurel.github.io/data/data-visualization/recife-history-connections/pages/sources.html
CH-0407,Mascarenhas de Morais,Personagem,,,,"João Batista Mascarenhas de Morais foi militar brasileiro, conhecido por comandar a Força Expedicionária Brasileira na campanha da Itália durante a Segunda Guerra Mundial. Sua memória está presente no Recife por meio da Avenida Marechal Mascarenhas de Morais, importante eixo viário que liga áreas da zona sul e da região metropolitana. o personagem conecta história militar, homenagem urbana e mobilidade, mostrando como figuras nacionais passam a integrar a paisagem cotidiana da cidade por meio de nomes de avenidas, ruas e equipamentos públicos.",Avenida Marechal Mascarenhas de Morais,,,,,,,,,,,,,,,"CH-0407 — Mascarenhas de Morais
Classificação: Personagem
Descrição: João Batista Mascarenhas de Morais foi militar brasileiro, conhecido por comandar a Força Expedicionária Brasileira na campanha da Itália durante a Segunda Guerra Mundial. Sua memória está presente no Recife por meio da Avenida Marechal Mascarenhas de Morais, importante eixo viário que liga áreas da zona sul e da região metropolitana. o personagem conecta história militar, homenagem urbana e mobilidade, mostrando como figuras nacionais passam a integrar a paisagem cotidiana da cidade por meio de nomes de avenidas, ruas e equipamentos públicos.
Interconexões: Avenida Marechal Mascarenhas de Morais",https://antonioaurel.github.io/data/data-visualization/recife-history-connections/pages/sources.html
CH-0408,Avenida Herculano Bandeira,Local,Logradouro,Pina,,"Avenida Herculano Bandeira é um logradouro localizado em Pina, no Recife/Pernambuco. Como via urbana, ajuda a compreender a circulação, a ocupação dos bairros e a permanência de homenagens na paisagem da cidade. aparece associado a Favela do Bode e Herculano Bandeira, indicando sua função como ponto de ligação entre território, memória e vida cotidiana. o registro permite observar como nomes de ruas e avenidas conectam personagens, instituições, eventos e transformações do Recife ao longo do tempo.",Favela do Bode,Herculano Bandeira,,,,,,,,,,,,,,"CH-0408 — Avenida Herculano Bandeira
Classificação: Local / Logradouro / Pina
Descrição: Avenida Herculano Bandeira é um logradouro localizado em Pina, no Recife/Pernambuco. Como via urbana, ajuda a compreender a circulação, a ocupação dos bairros e a permanência de homenagens na paisagem da cidade. aparece associado a Favela do Bode e Herculano Bandeira, indicando sua função como ponto de ligação entre território, memória e vida cotidiana. o registro permite observar como nomes de ruas e avenidas conectam personagens, instituições, eventos e transformações do Recife ao longo do tempo.
Interconexões: Favela do Bode; Herculano Bandeira",https://antonioaurel.github.io/data/data-visualization/recife-history-connections/pages/sources.html
CH-0409,Avenida da Madre de Deus,Local,Logradouro,Recife Antigo,,"Avenida da Madre de Deus é um logradouro localizado em Recife Antigo, no Recife/Pernambuco. Como via urbana, ajuda a compreender a circulação, a ocupação dos bairros e a permanência de homenagens na paisagem da cidade. aparece associado a Avenida Marques de Olinda, Avenida Rio Branco, Cais da Alfandega, Paço Alfandega, Ponte Mauricio de Nassau e Marco Zero, indicando sua função como ponto de ligação entre território, memória e vida cotidiana. o registro permite observar como nomes de ruas e avenidas conectam personagens, instituições, eventos e transformações do Recife ao longo do tempo.",Avenida Marquês de Olinda,Avenida Rio Branco,Cais da Alfândega,Paço Alfândega,Ponte Mauricio de Nassau,Marco Zero,Igreja da Madre de Deus,,,,,,,,,"CH-0409 — Avenida da Madre de Deus
Classificação: Local / Logradouro / Recife Antigo
Descrição: Avenida da Madre de Deus é um logradouro localizado em Recife Antigo, no Recife/Pernambuco. Como via urbana, ajuda a compreender a circulação, a ocupação dos bairros e a permanência de homenagens na paisagem da cidade. aparece associado a Avenida Marques de Olinda, Avenida Rio Branco, Cais da Alfandega, Paço Alfandega, Ponte Mauricio de Nassau e Marco Zero, indicando sua função como ponto de ligação entre território, memória e vida cotidiana. o registro permite observar como nomes de ruas e avenidas conectam personagens, instituições, eventos e transformações do Recife ao longo do tempo.
Interconexões: Avenida Marquês de Olinda; Avenida Rio Branco; Cais da Alfândega; Paço Alfândega; Ponte Mauricio de Nassau; Marco Zero; Igreja da Madre de Deus",https://antonioaurel.github.io/data/data-visualization/recife-history-connections/pages/sources.html
CH-0410,Dias Cardoso,Personagem,,,,"Antônio Dias Cardoso foi militar luso-brasileiro associado à Insurreição Pernambucana e às estratégias de combate contra o domínio holandês no século XVII. Sua atuação é frequentemente lembrada em relação à organização de forças locais e ao uso de táticas adaptadas ao território. aparece conectado à Invasão Holandesa e à Batalha do Monte das Tabocas, formando um elo entre personagens militares, resistência colonial e a memória da Restauração Pernambucana.",Invasão Holandesa,Batalha do Monte das Tabocas,,,,,,,,,,,,,,"CH-0410 — Dias Cardoso
Classificação: Personagem
Descrição: Antônio Dias Cardoso foi militar luso-brasileiro associado à Insurreição Pernambucana e às estratégias de combate contra o domínio holandês no século XVII. Sua atuação é frequentemente lembrada em relação à organização de forças locais e ao uso de táticas adaptadas ao território. aparece conectado à Invasão Holandesa e à Batalha do Monte das Tabocas, formando um elo entre personagens militares, resistência colonial e a memória da Restauração Pernambucana.
Interconexões: Invasão Holandesa; Batalha do Monte das Tabocas",https://antonioaurel.github.io/data/data-visualization/recife-history-connections/pages/sources.html
CH-0411,Praça Miguel de Cervantes,Local,Praça,Ilha do Leite,,"Praça Miguel de Cervantes é uma praça localizada em Ilha do Leite, no Recife/Pernambuco. Relaciona-se a Hospital Dom Pedro e Praça Chora Menino, indicando sua função como ponto de articulação entre território, memória e vida urbana. Sua presença ajuda a compreender como espaços públicos, edifícios, instituições e equipamentos acumulam camadas de uso social, homenagens e transformações ao longo do tempo. Praça Miguel de Cervantes funciona como referência para compreender a experiência cotidiana do Recife com processos históricos, culturais e políticos mais amplos.",Hospital Dom Pedro,Praça Chora Menino,,,,,,,,,,,,,,"CH-0411 — Praça Miguel de Cervantes
Classificação: Local / Praça / Ilha do Leite
Descrição: Praça Miguel de Cervantes é uma praça localizada em Ilha do Leite, no Recife/Pernambuco. Relaciona-se a Hospital Dom Pedro e Praça Chora Menino, indicando sua função como ponto de articulação entre território, memória e vida urbana. Sua presença ajuda a compreender como espaços públicos, edifícios, instituições e equipamentos acumulam camadas de uso social, homenagens e transformações ao longo do tempo. Praça Miguel de Cervantes funciona como referência para compreender a experiência cotidiana do Recife com processos históricos, culturais e políticos mais amplos.
Interconexões: Hospital Dom Pedro; Praça Chora Menino",https://antonioaurel.github.io/data/data-visualization/recife-history-connections/pages/sources.html
CH-0412,Praça Chora Menino,Local,Praça,Boa Vista,,"Praça Chora Menino é uma praça localizada em Boa Vista, no Recife/Pernambuco. Relaciona-se a Praça Miguel de Cervantes e Avenida Manoel Borba, indicando sua função como ponto de articulação entre território, memória e vida urbana. Sua presença ajuda a compreender como espaços públicos, edifícios, instituições e equipamentos acumulam camadas de uso social, homenagens e transformações ao longo do tempo. Praça Chora Menino funciona como referência para compreender a experiência cotidiana do Recife com processos históricos, culturais e políticos mais amplos.",Praça Miguel de Cervantes,Avenida Manoel Borba,,,,,,,,,,,,,,"CH-0412 — Praça Chora Menino
Classificação: Local / Praça / Boa Vista
Descrição: Praça Chora Menino é uma praça localizada em Boa Vista, no Recife/Pernambuco. Relaciona-se a Praça Miguel de Cervantes e Avenida Manoel Borba, indicando sua função como ponto de articulação entre território, memória e vida urbana. Sua presença ajuda a compreender como espaços públicos, edifícios, instituições e equipamentos acumulam camadas de uso social, homenagens e transformações ao longo do tempo. Praça Chora Menino funciona como referência para compreender a experiência cotidiana do Recife com processos históricos, culturais e políticos mais amplos.
Interconexões: Praça Miguel de Cervantes; Avenida Manoel Borba",https://antonioaurel.github.io/data/data-visualization/recife-history-connections/pages/sources.html
CH-0413,IMIP,Local,Hospital,Boa Vista,,"IMIP é um hospital localizado em Boa Vista, no Recife/Pernambuco. Sua presença na base indica a importância das instituições públicas, assistenciais, administrativas ou de saúde na organização da vida urbana de Pernambuco. O registro aparece associado a Polo Médico e Hospital Dom Pedro, permitindo observar como serviços, órgãos e edifícios institucionais estruturam bairros, fluxos e memórias coletivas. funciona como ponto de ligação entre gestão pública, cotidiano urbano e história social.",Polo Médico,Hospital Dom Pedro,,,,,,,,,,,,,,"CH-0413 — IMIP
Classificação: Local / Hospital / Boa Vista
Descrição: IMIP é um hospital localizado em Boa Vista, no Recife/Pernambuco. Sua presença na base indica a importância das instituições públicas, assistenciais, administrativas ou de saúde na organização da vida urbana de Pernambuco. O registro aparece associado a Polo Médico e Hospital Dom Pedro, permitindo observar como serviços, órgãos e edifícios institucionais estruturam bairros, fluxos e memórias coletivas. funciona como ponto de ligação entre gestão pública, cotidiano urbano e história social.
Interconexões: Polo Médico; Hospital Dom Pedro",https://antonioaurel.github.io/data/data-visualization/recife-history-connections/pages/sources.html
CH-0414,Hospital Dom Pedro,Local,Hospital,Boa Vista,,"Hospital Dom Pedro é um hospital localizado em Boa Vista, no Recife/Pernambuco. Sua presença na base indica a importância das instituições públicas, assistenciais, administrativas ou de saúde na organização da vida urbana de Pernambuco. O registro aparece associado a Polo Médico, IMIP e Praça Miguel de Cervantes, permitindo observar como serviços, órgãos e edifícios institucionais estruturam bairros, fluxos e memórias coletivas. funciona como ponto de ligação entre gestão pública, cotidiano urbano e história social.",Polo Médico,IMIP,Praça Miguel de Cervantes,,,,,,,,,,,,,"CH-0414 — Hospital Dom Pedro
Classificação: Local / Hospital / Boa Vista
Descrição: Hospital Dom Pedro é um hospital localizado em Boa Vista, no Recife/Pernambuco. Sua presença na base indica a importância das instituições públicas, assistenciais, administrativas ou de saúde na organização da vida urbana de Pernambuco. O registro aparece associado a Polo Médico, IMIP e Praça Miguel de Cervantes, permitindo observar como serviços, órgãos e edifícios institucionais estruturam bairros, fluxos e memórias coletivas. funciona como ponto de ligação entre gestão pública, cotidiano urbano e história social.
Interconexões: Polo Médico; IMIP; Praça Miguel de Cervantes",https://antonioaurel.github.io/data/data-visualization/recife-history-connections/pages/sources.html
CH-0415,Centro de Estudos e Sistemas Avançados do Recife (C.E.S.A.R),Local,Instituição,Recife Antigo,,"Centro de Estudos e Sistemas Avançados é uma instituição localizada em Recife Antigo, no Recife/Pernambuco. Sua presença na base indica a importância das instituições públicas, assistenciais, administrativas ou de saúde na organização da vida urbana de Pernambuco. O registro aparece associado a Praça Tiradentes, permitindo observar como serviços, órgãos e edifícios institucionais estruturam bairros, fluxos e memórias coletivas. funciona como ponto de ligação entre gestão pública, cotidiano urbano e história social.",Praça Tiradentes,Porto Digital,UFPE,CIN,,,,,,,,,,,,"CH-0415 — Centro de Estudos e Sistemas Avançados do Recife (C.E.S.A.R)
Classificação: Local / Instituição / Recife Antigo
Descrição: Centro de Estudos e Sistemas Avançados é uma instituição localizada em Recife Antigo, no Recife/Pernambuco. Sua presença na base indica a importância das instituições públicas, assistenciais, administrativas ou de saúde na organização da vida urbana de Pernambuco. O registro aparece associado a Praça Tiradentes, permitindo observar como serviços, órgãos e edifícios institucionais estruturam bairros, fluxos e memórias coletivas. funciona como ponto de ligação entre gestão pública, cotidiano urbano e história social.
Interconexões: Praça Tiradentes; Porto Digital; UFPE; CIN",https://antonioaurel.github.io/data/data-visualization/recife-history-connections/pages/sources.html
