ID,Nome,Tipo,Sub-Tipo,Local,Imagem,Descrição,Interconexão 1,Interconexão 2,Interconexão 3,Interconexão 4,Interconexão 5,Interconexão 6,Interconexão 7,Interconexão 8,Interconexão 9,Interconexão 10,Interconexão 11,Interconexão 12,Interconexão 13,Interconexão 14,Interconexão 15,Dados consolidados,Fonte da descrição
CH-0250,Padre Carapuceiro,Personagem,,,,"Padre Carapuceiro é uma figura associada à memória histórica, política, cultural ou urbana de Pernambuco. Sua trajetória se relaciona a O Carapuceiro, Rua Padre Carapuceiro, Mosteiro de São Bento e Praça da Indepedencia, o que indica sua relevância como elo entre biografia individual e memória pública. Seu registro ajuda a explicar como trajetórias pessoais se transformam em nomes de ruas, pontes, praças, instituições, movimentos ou referências culturais. Padre Carapuceiro funciona como registro de articulação entre personagens, fatos históricos e espaços da cidade, permitindo visualizar a história de Pernambuco como uma rede de relações.",O Carapuceiro,Rua Padre Carapuceiro,Mosteiro de São Bento,Praça da Independência,,,,,,,,,,,,"CH-0250 — Padre Carapuceiro
Classificação: Personagem
Descrição: Padre Carapuceiro é uma figura associada à memória histórica, política, cultural ou urbana de Pernambuco. Sua trajetória se relaciona a O Carapuceiro, Rua Padre Carapuceiro, Mosteiro de São Bento e Praça da Indepedencia, o que indica sua relevância como elo entre biografia individual e memória pública. Seu registro ajuda a explicar como trajetórias pessoais se transformam em nomes de ruas, pontes, praças, instituições, movimentos ou referências culturais. Padre Carapuceiro funciona como registro de articulação entre personagens, fatos históricos e espaços da cidade, permitindo visualizar a história de Pernambuco como uma rede de relações.
Interconexões: O Carapuceiro; Rua Padre Carapuceiro; Mosteiro de São Bento; Praça da Independência",https://antonioaurel.github.io/data/data-visualization/recife-history-connections/pages/sources.html
CH-0251,Padre Roma,Personagem,,,,"José Inácio Ribeiro de Abreu e Lima, conhecido como Padre Roma, foi religioso, advogado e revolucionário pernambucano ligado à Revolução de 1817. Pai do general Abreu e Lima, atuou na articulação política do movimento e foi enviado à Bahia em missão revolucionária, onde acabou preso e executado. Sua trajetória tornou-se símbolo do martírio republicano em Pernambuco. conecta-se a Abreu e Lima, à Revolução de 1817 e a outros registros da memória política pernambucana.",Abreu e Lima,Revolução Pernambucana de 1817,João Roma,,,,,,,,,,,,,"CH-0251 — Padre Roma
Classificação: Personagem
Descrição: José Inácio Ribeiro de Abreu e Lima, conhecido como Padre Roma, foi religioso, advogado e revolucionário pernambucano ligado à Revolução de 1817. Pai do general Abreu e Lima, atuou na articulação política do movimento e foi enviado à Bahia em missão revolucionária, onde acabou preso e executado. Sua trajetória tornou-se símbolo do martírio republicano em Pernambuco. conecta-se a Abreu e Lima, à Revolução de 1817 e a outros registros da memória política pernambucana.
Interconexões: Abreu e Lima; Revolução Pernambucana de 1817; João Roma",https://antonioaurel.github.io/data/data-visualization/recife-history-connections/pages/sources.html
CH-0252,Palácio da Justiça,Local,Instituição,Santo Antônio,,"Palácio da Justiça é uma instituição localizada em Santo Antônio, no Recife/Pernambuco. Sua presença na base indica a importância das instituições públicas, assistenciais, administrativas ou de saúde na organização da vida urbana de Pernambuco. O registro aparece associado a Praça da República, Estácio Coimbra, Sergio Loreto e Gervásio Pires, permitindo observar como serviços, órgãos e edifícios institucionais estruturam bairros, fluxos e memórias coletivas. funciona como ponto de ligação entre gestão pública, cotidiano urbano e história social.",Praça da República,Estácio Coimbra,Sérgio Loreto,Gervásio Pires,,,,,,,,,,,,"CH-0252 — Palácio da Justiça
Classificação: Local / Instituição / Santo Antônio
Descrição: Palácio da Justiça é uma instituição localizada em Santo Antônio, no Recife/Pernambuco. Sua presença na base indica a importância das instituições públicas, assistenciais, administrativas ou de saúde na organização da vida urbana de Pernambuco. O registro aparece associado a Praça da República, Estácio Coimbra, Sergio Loreto e Gervásio Pires, permitindo observar como serviços, órgãos e edifícios institucionais estruturam bairros, fluxos e memórias coletivas. funciona como ponto de ligação entre gestão pública, cotidiano urbano e história social.
Interconexões: Praça da República; Estácio Coimbra; Sérgio Loreto; Gervásio Pires",https://antonioaurel.github.io/data/data-visualization/recife-history-connections/pages/sources.html
CH-0253,Palácio do Campo das Princesas,Local,Instituição,Santo Antônio,,"O Palácio do Campo das Princesas é a sede do Governo de Pernambuco, localizado na Praça da República, no bairro de Santo Antônio. O edifício é um dos principais símbolos do poder político estadual e reúne memórias de governos, decisões administrativas, cerimônias públicas e episódios da história republicana. Seu nome e sua localização o vinculam ao conjunto monumental do centro do Recife. conecta-se a governadores, políticos e instituições, funcionando como registro central da história administrativa e política pernambucana.",Manoel Borba,Praça da República,,,,,,,,,,,,,,"CH-0253 — Palácio do Campo das Princesas
Classificação: Local / Instituição / Santo Antônio
Descrição: O Palácio do Campo das Princesas é a sede do Governo de Pernambuco, localizado na Praça da República, no bairro de Santo Antônio. O edifício é um dos principais símbolos do poder político estadual e reúne memórias de governos, decisões administrativas, cerimônias públicas e episódios da história republicana. Seu nome e sua localização o vinculam ao conjunto monumental do centro do Recife. conecta-se a governadores, políticos e instituições, funcionando como registro central da história administrativa e política pernambucana.
Interconexões: Manoel Borba; Praça da República",https://antonioaurel.github.io/data/data-visualization/recife-history-connections/pages/sources.html
CH-0254,Palácio dos Manguinhos,Local,Templo Religioso,Graças,,"Palacio dos Manguinhos é um templo religioso localizado em Graças, no Recife/Pernambuco. O registro representa a presença da religiosidade, da arquitetura sacra e das práticas devocionais na formação histórica de Pernambuco. aparece associado a Avenida Rui Barbosa, evidenciando como igrejas, conventos e espaços de fé funcionam como pontos de encontro, patrimônio e referência urbana. conecta espiritualidade, arte, sociabilidade e história local.",Avenida Rui Barbosa,,,,,,,,,,,,,,,"CH-0254 — Palácio dos Manguinhos
Classificação: Local / Templo Religioso / Graças
Descrição: Palacio dos Manguinhos é um templo religioso localizado em Graças, no Recife/Pernambuco. O registro representa a presença da religiosidade, da arquitetura sacra e das práticas devocionais na formação histórica de Pernambuco. aparece associado a Avenida Rui Barbosa, evidenciando como igrejas, conventos e espaços de fé funcionam como pontos de encontro, patrimônio e referência urbana. conecta espiritualidade, arte, sociabilidade e história local.
Interconexões: Avenida Rui Barbosa",https://antonioaurel.github.io/data/data-visualization/recife-history-connections/pages/sources.html
CH-0255,Parque da Jaqueira,Local,Praça,Jaqueira,,"Paque da Jaqueira é uma praça localizada em Jaqueira, no Recife/Pernambuco. Relaciona-se a Avenida Rui Barbosa e Rio Capibaribe, indicando sua função como ponto de articulação entre território, memória e vida urbana. Sua presença ajuda a compreender como espaços públicos, edifícios, instituições e equipamentos acumulam camadas de uso social, homenagens e transformações ao longo do tempo. Paque da Jaqueira funciona como referência para compreender a experiência cotidiana do Recife com processos históricos, culturais e políticos mais amplos.",Avenida Rui Barbosa,Rio Capibaribe,,,,,,,,,,,,,,"CH-0255 — Parque da Jaqueira
Classificação: Local / Praça / Jaqueira
Descrição: Paque da Jaqueira é uma praça localizada em Jaqueira, no Recife/Pernambuco. Relaciona-se a Avenida Rui Barbosa e Rio Capibaribe, indicando sua função como ponto de articulação entre território, memória e vida urbana. Sua presença ajuda a compreender como espaços públicos, edifícios, instituições e equipamentos acumulam camadas de uso social, homenagens e transformações ao longo do tempo. Paque da Jaqueira funciona como referência para compreender a experiência cotidiana do Recife com processos históricos, culturais e políticos mais amplos.
Interconexões: Avenida Rui Barbosa; Rio Capibaribe",https://antonioaurel.github.io/data/data-visualization/recife-history-connections/pages/sources.html
CH-0256,Parceria nos Morros,Fato Histórico,Iniciativa Governamental,,,"Parceria nos Morros é um iniciativa governamental relacionado à história de Pernambuco. Relaciona-se a Desabamentos em Morros do Recife, formando uma ponte entre acontecimentos, espaços urbanos e personagens públicos. O registro ajuda a contextualizar disputas políticas, mudanças sociais, conflitos, práticas culturais ou transformações ambientais que marcaram a formação pernambucana. Parceria nos Morros funciona como eixo narrativo para compreender como eventos coletivos deixam marcas na paisagem, na memória pública e nas conexões entre diferentes pontos do território.",Desabamentos em Morros do Recife,,,,,,,,,,,,,,,"CH-0256 — Parceria nos Morros
Classificação: Fato Histórico / Iniciativa Governamental
Descrição: Parceria nos Morros é um iniciativa governamental relacionado à história de Pernambuco. Relaciona-se a Desabamentos em Morros do Recife, formando uma ponte entre acontecimentos, espaços urbanos e personagens públicos. O registro ajuda a contextualizar disputas políticas, mudanças sociais, conflitos, práticas culturais ou transformações ambientais que marcaram a formação pernambucana. Parceria nos Morros funciona como eixo narrativo para compreender como eventos coletivos deixam marcas na paisagem, na memória pública e nas conexões entre diferentes pontos do território.
Interconexões: Desabamentos em Morros do Recife",https://antonioaurel.github.io/data/data-visualization/recife-history-connections/pages/sources.html
CH-0257,Jardim do Baobá,Local,Praça,Graças,,"Jardim do Baobá é uma praça localizada em Graças, no Recife/Pernambuco. Relaciona-se a Avenida Rui Barbosa e Academia Pernambucana de Letras, indicando sua função como ponto de articulação entre território, memória e vida urbana. Sua presença ajuda a compreender como espaços públicos, edifícios, instituições e equipamentos acumulam camadas de uso social, homenagens e transformações ao longo do tempo. Jardim do Baobá funciona como referência para compreender a experiência cotidiana do Recife com processos históricos, culturais e políticos mais amplos.",Avenida Rui Barbosa,Academia Pernambucana de Letras,,,,,,,,,,,,,,"CH-0257 — Jardim do Baobá
Classificação: Local / Praça / Graças
Descrição: Jardim do Baobá é uma praça localizada em Graças, no Recife/Pernambuco. Relaciona-se a Avenida Rui Barbosa e Academia Pernambucana de Letras, indicando sua função como ponto de articulação entre território, memória e vida urbana. Sua presença ajuda a compreender como espaços públicos, edifícios, instituições e equipamentos acumulam camadas de uso social, homenagens e transformações ao longo do tempo. Jardim do Baobá funciona como referência para compreender a experiência cotidiana do Recife com processos históricos, culturais e políticos mais amplos.
Interconexões: Avenida Rui Barbosa; Academia Pernambucana de Letras",https://antonioaurel.github.io/data/data-visualization/recife-history-connections/pages/sources.html
CH-0258,Pátio de São Pedro,Local,Praça,São José,,"Patio de São Pedro é uma praça localizada em São José, no Recife/Pernambuco. Relaciona-se a Avenida Dantas Barreto, Sebastião de Castro Caldas e Igreja de São Pedro dos Clerigos, indicando sua função como ponto de articulação entre território, memória e vida urbana. Sua presença ajuda a compreender como espaços públicos, edifícios, instituições e equipamentos acumulam camadas de uso social, homenagens e transformações ao longo do tempo. Patio de São Pedro funciona como referência para compreender a experiência cotidiana do Recife com processos históricos, culturais e políticos mais amplos.",Avenida Dantas Barreto,Sebastião de Castro Caldas,Igreja de São Pedro dos Clérigos,,,,,,,,,,,,,"CH-0258 — Pátio de São Pedro
Classificação: Local / Praça / São José
Descrição: Patio de São Pedro é uma praça localizada em São José, no Recife/Pernambuco. Relaciona-se a Avenida Dantas Barreto, Sebastião de Castro Caldas e Igreja de São Pedro dos Clerigos, indicando sua função como ponto de articulação entre território, memória e vida urbana. Sua presença ajuda a compreender como espaços públicos, edifícios, instituições e equipamentos acumulam camadas de uso social, homenagens e transformações ao longo do tempo. Patio de São Pedro funciona como referência para compreender a experiência cotidiana do Recife com processos históricos, culturais e políticos mais amplos.
Interconexões: Avenida Dantas Barreto; Sebastião de Castro Caldas; Igreja de São Pedro dos Clérigos",https://antonioaurel.github.io/data/data-visualization/recife-history-connections/pages/sources.html
CH-0259,Pátio do Livramento,Local,Praça,São José,,"Patio do Livramento é uma praça localizada em São José, no Recife/Pernambuco. Relaciona-se a Igreja do Livramento, indicando sua função como ponto de articulação entre território, memória e vida urbana. Sua presença ajuda a compreender como espaços públicos, edifícios, instituições e equipamentos acumulam camadas de uso social, homenagens e transformações ao longo do tempo. Patio do Livramento funciona como referência para compreender a experiência cotidiana do Recife com processos históricos, culturais e políticos mais amplos.",Igreja do Livramento,Rua Direita,Rua das Calçadas,Avenida Nossa Senhora do Carmo,,,,,,,,,,,,"CH-0259 — Pátio do Livramento
Classificação: Local / Praça / São José
Descrição: Patio do Livramento é uma praça localizada em São José, no Recife/Pernambuco. Relaciona-se a Igreja do Livramento, indicando sua função como ponto de articulação entre território, memória e vida urbana. Sua presença ajuda a compreender como espaços públicos, edifícios, instituições e equipamentos acumulam camadas de uso social, homenagens e transformações ao longo do tempo. Patio do Livramento funciona como referência para compreender a experiência cotidiana do Recife com processos históricos, culturais e políticos mais amplos.
Interconexões: Igreja do Livramento; Rua Direita; Rua das Calçadas; Avenida Nossa Senhora do Carmo",https://antonioaurel.github.io/data/data-visualization/recife-history-connections/pages/sources.html
CH-0260,Paulo Guerra,Personagem,,,,"Paulo Guerra é uma figura associada à memória histórica, política, cultural ou urbana de Pernambuco. Sua trajetória se relaciona a Hospital da Restauração, Ponte Paulo Guerra, Agamenon Magalhães, Nilo Coelho e Miguel Arraes, o que indica sua relevância como elo entre biografia individual e memória pública. Seu registro ajuda a explicar como trajetórias pessoais se transformam em nomes de ruas, pontes, praças, instituições, movimentos ou referências culturais. Paulo Guerra funciona como registro de articulação entre personagens, fatos históricos e espaços da cidade, permitindo visualizar a história de Pernambuco como uma rede de relações.",Hospital da Restauração,Ponte Paulo Guerra,Agamenon Magalhães,Nilo Coelho,Miguel Arraes,,,,,,,,,,,"CH-0260 — Paulo Guerra
Classificação: Personagem
Descrição: Paulo Guerra é uma figura associada à memória histórica, política, cultural ou urbana de Pernambuco. Sua trajetória se relaciona a Hospital da Restauração, Ponte Paulo Guerra, Agamenon Magalhães, Nilo Coelho e Miguel Arraes, o que indica sua relevância como elo entre biografia individual e memória pública. Seu registro ajuda a explicar como trajetórias pessoais se transformam em nomes de ruas, pontes, praças, instituições, movimentos ou referências culturais. Paulo Guerra funciona como registro de articulação entre personagens, fatos históricos e espaços da cidade, permitindo visualizar a história de Pernambuco como uma rede de relações.
Interconexões: Hospital da Restauração; Ponte Paulo Guerra; Agamenon Magalhães; Nilo Coelho; Miguel Arraes",https://antonioaurel.github.io/data/data-visualization/recife-history-connections/pages/sources.html
CH-0261,Pedro da Silva Pedroso,Personagem,,,,"Pedro da Silva Pedroso é uma figura associada à memória histórica, política, cultural ou urbana de Pernambuco. Sua trajetória se relaciona a Revolução de 1817, Confederação do Equador, José de Barros Lima (Leão Coroado) e Gervásio Pires, o que indica sua relevância como elo entre biografia individual e memória pública. Seu registro ajuda a explicar como trajetórias pessoais se transformam em nomes de ruas, pontes, praças, instituições, movimentos ou referências culturais. Pedro da Silva Pedroso funciona como registro de articulação entre personagens, fatos históricos e espaços da cidade, permitindo visualizar a história de Pernambuco como uma rede de relações.",Revolução Pernambucana de 1817,Confederação do Equador,José de Barros Lima (Leão Coroado),Gervásio Pires,,,,,,,,,,,,"CH-0261 — Pedro da Silva Pedroso
Classificação: Personagem
Descrição: Pedro da Silva Pedroso é uma figura associada à memória histórica, política, cultural ou urbana de Pernambuco. Sua trajetória se relaciona a Revolução de 1817, Confederação do Equador, José de Barros Lima (Leão Coroado) e Gervásio Pires, o que indica sua relevância como elo entre biografia individual e memória pública. Seu registro ajuda a explicar como trajetórias pessoais se transformam em nomes de ruas, pontes, praças, instituições, movimentos ou referências culturais. Pedro da Silva Pedroso funciona como registro de articulação entre personagens, fatos históricos e espaços da cidade, permitindo visualizar a história de Pernambuco como uma rede de relações.
Interconexões: Revolução Pernambucana de 1817; Confederação do Equador; José de Barros Lima (Leão Coroado); Gervásio Pires",https://antonioaurel.github.io/data/data-visualization/recife-history-connections/pages/sources.html
CH-0262,Pedro Ivo,Personagem,,,,"Pedro Ivo é uma figura associada à memória histórica, política, cultural ou urbana de Pernambuco. Sua trajetória se relaciona a Revolução Praieira e Borges da Fonsesca, o que indica sua relevância como elo entre biografia individual e memória pública. Seu registro ajuda a explicar como trajetórias pessoais se transformam em nomes de ruas, pontes, praças, instituições, movimentos ou referências culturais. Pedro Ivo funciona como registro de articulação entre personagens, fatos históricos e espaços da cidade, permitindo visualizar a história de Pernambuco como uma rede de relações.",Revolução Praieira,Borges da Fonseca,,,,,,,,,,,,,,"CH-0262 — Pedro Ivo
Classificação: Personagem
Descrição: Pedro Ivo é uma figura associada à memória histórica, política, cultural ou urbana de Pernambuco. Sua trajetória se relaciona a Revolução Praieira e Borges da Fonsesca, o que indica sua relevância como elo entre biografia individual e memória pública. Seu registro ajuda a explicar como trajetórias pessoais se transformam em nomes de ruas, pontes, praças, instituições, movimentos ou referências culturais. Pedro Ivo funciona como registro de articulação entre personagens, fatos históricos e espaços da cidade, permitindo visualizar a história de Pernambuco como uma rede de relações.
Interconexões: Revolução Praieira; Borges da Fonseca",https://antonioaurel.github.io/data/data-visualization/recife-history-connections/pages/sources.html
CH-0263,Pedro Lopes,Personagem,,,,"Pedro Lopes é uma figura associada à memória histórica, política, cultural ou urbana de Pernambuco. Sua trajetória se relaciona a Duarte Coelho Pereira e Indios, o que indica sua relevância como elo entre biografia individual e memória pública. Seu registro ajuda a explicar como trajetórias pessoais se transformam em nomes de ruas, pontes, praças, instituições, movimentos ou referências culturais. Pedro Lopes funciona como registro de articulação entre personagens, fatos históricos e espaços da cidade, permitindo visualizar a história de Pernambuco como uma rede de relações.",Duarte Coelho Pereira,Povos Originários (Índios),,,,,,,,,,,,,,"CH-0263 — Pedro Lopes
Classificação: Personagem
Descrição: Pedro Lopes é uma figura associada à memória histórica, política, cultural ou urbana de Pernambuco. Sua trajetória se relaciona a Duarte Coelho Pereira e Indios, o que indica sua relevância como elo entre biografia individual e memória pública. Seu registro ajuda a explicar como trajetórias pessoais se transformam em nomes de ruas, pontes, praças, instituições, movimentos ou referências culturais. Pedro Lopes funciona como registro de articulação entre personagens, fatos históricos e espaços da cidade, permitindo visualizar a história de Pernambuco como uma rede de relações.
Interconexões: Duarte Coelho Pereira; Povos Originários (Índios)",https://antonioaurel.github.io/data/data-visualization/recife-history-connections/pages/sources.html
CH-0264,Pelópidas Silveira,Personagem,,,,"Professor de Engenharia e diretor de Viação e Obras Públicas de Pernambuco, ele era um técnico sem militância política, com apenas 30 anos de idade, quando o interventor José Domingues o convidou a assumir a Prefeitura do Recife, em fevereiro de 1946.

Além das intervenções sociais e urbanísticas do seu primeiro mandato, Pelópidas, no segundo, reformou as avenidas Caxangá e Norte, ligou os bairros de Casa Amarela e Beberibe e abriu o canal Derby-Tacaruna. Também criou o Sítio da Trindade, aprimorou a legislação e o código tributário municipais, e fundou a Companhia de Transportes Urbanos (CTU), substituindo os antigos bondes por modernos ônibus elétricos. E para dar voz ao povo criou audiências públicas e estimulou a criação de associações
de bairro.",Avenida Dantas Barreto,Prefeitura do Recife,Terminal Pelópidas Silveira,Hospital Pelópidas Silveira,Barbosa Lima,,,,,,,,,,,"CH-0264 — Pelópidas Silveira
Classificação: Personagem
Descrição: Professor de Engenharia e diretor de Viação e Obras Públicas de Pernambuco, ele era um técnico sem militância política, com apenas 30 anos de idade, quando o interventor José Domingues o convidou a assumir a Prefeitura do Recife, em fevereiro de 1946.

Além das intervenções sociais e urbanísticas do seu primeiro mandato, Pelópidas, no segundo, reformou as avenidas Caxangá e Norte, ligou os bairros de Casa Amarela e Beberibe e abriu o canal Derby-Tacaruna. Também criou o Sítio da Trindade, aprimorou a legislação e o código tributário municipais, e fundou a Companhia de Transportes Urbanos (CTU), substituindo os antigos bondes por modernos ônibus elétricos. E para dar voz ao povo criou audiências públicas e estimulou a criação de associações
de bairro.
Interconexões: Avenida Dantas Barreto; Prefeitura do Recife; Terminal Pelópidas Silveira; Hospital Pelópidas Silveira; Barbosa Lima",https://antonioaurel.github.io/data/data-visualization/recife-history-connections/pages/sources.html
CH-0265,Pernambuco Tramways,Fato Histórico,Sítio Histórico,,,"Pernambuco Tramways é um sitio histórico relacionado à história de Pernambuco. Relaciona-se a Transporte Publico no Recife e Ponte D'Uchôa, formando uma ponte entre acontecimentos, espaços urbanos e personagens públicos. O registro ajuda a contextualizar disputas políticas, mudanças sociais, conflitos, práticas culturais ou transformações ambientais que marcaram a formação pernambucana. Pernambuco Tramways funciona como eixo narrativo para compreender como eventos coletivos deixam marcas na paisagem, na memória pública e nas conexões entre diferentes pontos do território.",Transporte Público no Recife,Ponte D'Uchôa,,,,,,,,,,,,,,"CH-0265 — Pernambuco Tramways
Classificação: Fato Histórico / Sítio Histórico
Descrição: Pernambuco Tramways é um sitio histórico relacionado à história de Pernambuco. Relaciona-se a Transporte Publico no Recife e Ponte D'Uchôa, formando uma ponte entre acontecimentos, espaços urbanos e personagens públicos. O registro ajuda a contextualizar disputas políticas, mudanças sociais, conflitos, práticas culturais ou transformações ambientais que marcaram a formação pernambucana. Pernambuco Tramways funciona como eixo narrativo para compreender como eventos coletivos deixam marcas na paisagem, na memória pública e nas conexões entre diferentes pontos do território.
Interconexões: Transporte Público no Recife; Ponte D'Uchôa",https://antonioaurel.github.io/data/data-visualization/recife-history-connections/pages/sources.html
