ID,Nome,Tipo,Sub-Tipo,Local,Imagem,Descrição,Interconexão 1,Interconexão 2,Interconexão 3,Interconexão 4,Interconexão 5,Interconexão 6,Interconexão 7,Interconexão 8,Interconexão 9,Interconexão 10,Interconexão 11,Interconexão 12,Interconexão 13,Interconexão 14,Interconexão 15,Dados consolidados,Fonte da descrição
CH-0131,Favela do Bode,Local,Bairro,Pina,,"Favela do Bode é um bairro localizado em Pina, no Recife/Pernambuco. Relaciona-se a Maracatu Porto Rico, Avenida Herculano Bandeira e Rio Mar Shopping, indicando sua função como ponto de articulação entre território, memória e vida urbana. Sua presença ajuda a compreender como espaços públicos, edifícios, instituições e equipamentos acumulam camadas de uso social, homenagens e transformações ao longo do tempo. Favela do Bode funciona como referência para compreender a experiência cotidiana do Recife com processos históricos, culturais e políticos mais amplos.",Maracatu Porto Rico,Avenida Herculano Bandeira,Rio Mar Shopping,,,,,,,,,,,,,"CH-0131 — Favela do Bode
Classificação: Local / Bairro / Pina
Descrição: Favela do Bode é um bairro localizado em Pina, no Recife/Pernambuco. Relaciona-se a Maracatu Porto Rico, Avenida Herculano Bandeira e Rio Mar Shopping, indicando sua função como ponto de articulação entre território, memória e vida urbana. Sua presença ajuda a compreender como espaços públicos, edifícios, instituições e equipamentos acumulam camadas de uso social, homenagens e transformações ao longo do tempo. Favela do Bode funciona como referência para compreender a experiência cotidiana do Recife com processos históricos, culturais e políticos mais amplos.
Interconexões: Maracatu Porto Rico; Avenida Herculano Bandeira; Rio Mar Shopping",https://antonioaurel.github.io/data/data-visualization/recife-history-connections/pages/sources.html
CH-0132,Antônio Filipe Camarão,Personagem,,,,"Poti de nascença e Antonio Felipe Camarão, de batismo foi um Potiguara, nascido em terras de hoje são o Ceará Mirim, no Rio Grande do Norte, época uma capitania. Foi Educado por Jesuitas, onde aprendeu português e latim, tornando Aide-de-camp de Matias de Albuquerque quando o Holandeses Invadiram e conquistaram Pernambuco em 1630. 

Em sua retirada, Matias de Albuquerque pode contar com as táticas de guerrilha de Felipe Camarão para conter o avanço holandeses, retardando as operações do inimigo e permitindo realocar recursos para estabelecimento do governo provisório em Salvador. 

Camarão sempre teve ao seu lado Clara Camarão e as tropas indigenas comandadas por eles foram fundamentais nos combates de São Lourenço(1636) e Porto Calvo(1637) e na defesa de Salvador (1638). 

Depois de provar mais de uma centena de vezes a sua bravura em combate, foi encarregado de uma das alas do exercito patriota na vitória Luso-Brasileira na Primeira Batalha dos Guararapes (1648), onde foi ferido em combate.   Declarado herói da coroa, recebendo o comando de “todas as tropas indígenas do Brasil”, morreu no mesmo ano devidos aos danos causados em batalha, no Arraial do Bom Jesus, hoje Avenida do Forte, em Torrões, Recife. 

A Sétima Brigada de Infantaria Motorizada, do Exercito Brasileiro tem seu nome em homenagem a Felipe Camarão, assim como o Batalhão de Transito da PMPE. 

Felipe Camarão está listado no Livro de Heróis da Pátria, desde 2012.",Igreja da Várzea,Cruzeiro do Forte,Invasão Holandesa,Barreto de Menezes,Dias Cardoso,Matias de Albuquerque,Maurício de Nassau,Batalha dos Guararapes,Invasões Holandesas do Brasil,Conquista de Olinda,,,,,,"CH-0132 — Antônio Filipe Camarão
Classificação: Personagem
Descrição: Poti de nascença e Antonio Felipe Camarão, de batismo foi um Potiguara, nascido em terras de hoje são o Ceará Mirim, no Rio Grande do Norte, época uma capitania. Foi Educado por Jesuitas, onde aprendeu português e latim, tornando Aide-de-camp de Matias de Albuquerque quando o Holandeses Invadiram e conquistaram Pernambuco em 1630. 

Em sua retirada, Matias de Albuquerque pode contar com as táticas de guerrilha de Felipe Camarão para conter o avanço holandeses, retardando as operações do inimigo e permitindo realocar recursos para estabelecimento do governo provisório em Salvador. 

Camarão sempre teve ao seu lado Clara Camarão e as tropas indigenas comandadas por eles foram fundamentais nos combates de São Lourenço(1636) e Porto Calvo(1637) e na defesa de Salvador (1638). 

Depois de provar mais de uma centena de vezes a sua bravura em combate, foi encarregado de uma das alas do exercito patriota na vitória Luso-Brasileira na Primeira Batalha dos Guararapes (1648), onde foi ferido em combate.   Declarado herói da coroa, recebendo o comando de “todas as tropas indígenas do Brasil”, morreu no mesmo ano devidos aos danos causados em batalha, no Arraial do Bom Jesus, hoje Avenida do Forte, em Torrões, Recife. 

A Sétima Brigada de Infantaria Motorizada, do Exercito Brasileiro tem seu nome em homenagem a Felipe Camarão, assim como o Batalhão de Transito da PMPE. 

Felipe Camarão está listado no Livro de Heróis da Pátria, desde 2012.
Interconexões: Igreja da Várzea; Cruzeiro do Forte; Invasão Holandesa; Barreto de Menezes; Dias Cardoso; Matias de Albuquerque; Maurício de Nassau; Batalha dos Guararapes; Invasões Holandesas do Brasil; Conquista de Olinda",https://antonioaurel.github.io/data/data-visualization/recife-history-connections/pages/sources.html
CH-0133,Félix de Brito,Personagem,,,,"Militar, magistrado e político, Félix Peixoto de Brito e Melo nasceu no Recife, a 24-08-1807. Participou, em 1822, na Bahia, das lutas pela manutenção da Independência, conquistando o título de alferes aos 15 anos de idade.

Em 1824, aderiu, em Pernambuco, à Confederação do Equador e fugiu, após a derrota do movimento, retornando ao Recife anos depois.

Bacharel em Direito (Olinda, PE, 1834), foi juiz no Recife (1838). Deputado provincial (1836 a 1842) e deputado geral (de 1845 a 1848). Presidente da província de Alagoas em 1847, deixou o cargo no ano seguinte para tornar-se deputado por Pernambuco.

Em 1848, tornou-se um dos principais líderes da Revolta Praieira que eclodiu em Pernambuco. Com a derrota do movimento praieiro, no início de 1849 fugiu para Alagoas e, em seguida, exilou-se em Portugal, onde passaria a residir definitivamente.

Anistiado, foi cônsul-geral do Brasil na Espanha. Morreu a 13-01-1878, ocasião em que fazia, com a filha única, uma visita ao Recife.",Revolução Praieira,Rua Félix de Brito e Melo,,,,,,,,,,,,,,"CH-0133 — Félix de Brito
Classificação: Personagem
Descrição: Militar, magistrado e político, Félix Peixoto de Brito e Melo nasceu no Recife, a 24-08-1807. Participou, em 1822, na Bahia, das lutas pela manutenção da Independência, conquistando o título de alferes aos 15 anos de idade.

Em 1824, aderiu, em Pernambuco, à Confederação do Equador e fugiu, após a derrota do movimento, retornando ao Recife anos depois.

Bacharel em Direito (Olinda, PE, 1834), foi juiz no Recife (1838). Deputado provincial (1836 a 1842) e deputado geral (de 1845 a 1848). Presidente da província de Alagoas em 1847, deixou o cargo no ano seguinte para tornar-se deputado por Pernambuco.

Em 1848, tornou-se um dos principais líderes da Revolta Praieira que eclodiu em Pernambuco. Com a derrota do movimento praieiro, no início de 1849 fugiu para Alagoas e, em seguida, exilou-se em Portugal, onde passaria a residir definitivamente.

Anistiado, foi cônsul-geral do Brasil na Espanha. Morreu a 13-01-1878, ocasião em que fazia, com a filha única, uma visita ao Recife.
Interconexões: Revolução Praieira; Rua Félix de Brito e Melo",https://antonioaurel.github.io/data/data-visualization/recife-history-connections/pages/sources.html
CH-0134,Fernandes Vieira,Personagem,,,,"João Fernandes Vieira foi senhor de engenho e liderança central da Insurreição Pernambucana contra o domínio holandês. Atuou na articulação política e militar que fortaleceu a resistência luso-brasileira no século XVII, participando de episódios decisivos como a Batalha do Monte das Tabocas e as Batalhas dos Guararapes. Sua figura é lembrada como um dos principais nomes da Restauração Pernambucana. conecta-se a conflitos, personagens militares e espaços de memória associados à expulsão dos holandeses de Pernambuco.",Invasão Holandesa,Cruzeiro do Forte,Forte das Cinco Pontas,Batalha do Monte das Tabocas,,,,,,,,,,,,"CH-0134 — Fernandes Vieira
Classificação: Personagem
Descrição: João Fernandes Vieira foi senhor de engenho e liderança central da Insurreição Pernambucana contra o domínio holandês. Atuou na articulação política e militar que fortaleceu a resistência luso-brasileira no século XVII, participando de episódios decisivos como a Batalha do Monte das Tabocas e as Batalhas dos Guararapes. Sua figura é lembrada como um dos principais nomes da Restauração Pernambucana. conecta-se a conflitos, personagens militares e espaços de memória associados à expulsão dos holandeses de Pernambuco.
Interconexões: Invasão Holandesa; Cruzeiro do Forte; Forte das Cinco Pontas; Batalha do Monte das Tabocas",https://antonioaurel.github.io/data/data-visualization/recife-history-connections/pages/sources.html
CH-0135,Fortaleza do Buraco,Local,Forte,Recife Antigo,,"Fortaleza do Buraco é um forte localizado em Recife Antigo, no Recife/Pernambuco. Relaciona-se a Porto do Recife e Cais da Lingueta, indicando sua função como ponto de articulação entre território, memória e vida urbana. Sua presença ajuda a compreender como espaços públicos, edifícios, instituições e equipamentos acumulam camadas de uso social, homenagens e transformações ao longo do tempo. Fortaleza do Buraco funciona como referência para compreender a experiência cotidiana do Recife com processos históricos, culturais e políticos mais amplos.",Porto do Recife,Cais da Lingueta,Pilar,Forte de São Francisco,Farol de Olinda,,,,,,,,,,,"CH-0135 — Fortaleza do Buraco
Classificação: Local / Forte / Recife Antigo
Descrição: Fortaleza do Buraco é um forte localizado em Recife Antigo, no Recife/Pernambuco. Relaciona-se a Porto do Recife e Cais da Lingueta, indicando sua função como ponto de articulação entre território, memória e vida urbana. Sua presença ajuda a compreender como espaços públicos, edifícios, instituições e equipamentos acumulam camadas de uso social, homenagens e transformações ao longo do tempo. Fortaleza do Buraco funciona como referência para compreender a experiência cotidiana do Recife com processos históricos, culturais e políticos mais amplos.
Interconexões: Porto do Recife; Cais da Lingueta; Pilar; Forte de São Francisco; Farol de Olinda",https://antonioaurel.github.io/data/data-visualization/recife-history-connections/pages/sources.html
CH-0136,Forte das Cinco Pontas,Local,Forte,São José,,"O Forte das Cinco Pontas é uma das construções militares mais importantes do Recife. Erguido no período da ocupação holandesa e depois transformado pelos portugueses, o forte marcou a defesa da região sul da área central e a relação da cidade com rios, portos e caminhos de acesso. Atualmente, é também um espaço de memória histórica e cultural. conecta-se ao Cais José Estelita, à Confederação do Equador e a outros pontos do bairro de São José, articulando defesa militar, patrimônio colonial e história política.",Frei Caneca,João Gabriel,Confederação do Equador,Invasão Holandesa,Fernandes Vieira,Barreto de Menezes,Forte do Brum,Monumento a Frei Caneca,Forte de São Francisco,Farol de Olinda,,,,,,"CH-0136 — Forte das Cinco Pontas
Classificação: Local / Forte / São José
Descrição: O Forte das Cinco Pontas é uma das construções militares mais importantes do Recife. Erguido no período da ocupação holandesa e depois transformado pelos portugueses, o forte marcou a defesa da região sul da área central e a relação da cidade com rios, portos e caminhos de acesso. Atualmente, é também um espaço de memória histórica e cultural. conecta-se ao Cais José Estelita, à Confederação do Equador e a outros pontos do bairro de São José, articulando defesa militar, patrimônio colonial e história política.
Interconexões: Frei Caneca; João Gabriel; Confederação do Equador; Invasão Holandesa; Fernandes Vieira; Barreto de Menezes; Forte do Brum; Monumento a Frei Caneca; Forte de São Francisco; Farol de Olinda",https://antonioaurel.github.io/data/data-visualization/recife-history-connections/pages/sources.html
CH-0137,Forte do Brum,Local,Forte,Recife Antigo,,"O Forte do Brum é uma fortificação histórica localizada no Recife Antigo, associada à defesa da cidade desde o período colonial. Sua trajetória atravessa a presença holandesa, a reorganização portuguesa e a função militar do porto do Recife. Como patrimônio material, representa a importância estratégica da cidade nas disputas atlânticas dos séculos XVI e XVII. conecta-se a Caetano Pinto, Revolução de 1817 e outros pontos de memória militar, funcionando como registro entre fortificação, poder colonial e conflitos políticos.",Forte das Cinco Pontas,Invasão Holandesa,Caetano Pinto,Estação do Brum,Forte de São Francisco,Farol de Olinda,,,,,,,,,,"CH-0137 — Forte do Brum
Classificação: Local / Forte / Recife Antigo
Descrição: O Forte do Brum é uma fortificação histórica localizada no Recife Antigo, associada à defesa da cidade desde o período colonial. Sua trajetória atravessa a presença holandesa, a reorganização portuguesa e a função militar do porto do Recife. Como patrimônio material, representa a importância estratégica da cidade nas disputas atlânticas dos séculos XVI e XVII. conecta-se a Caetano Pinto, Revolução de 1817 e outros pontos de memória militar, funcionando como registro entre fortificação, poder colonial e conflitos políticos.
Interconexões: Forte das Cinco Pontas; Invasão Holandesa; Caetano Pinto; Estação do Brum; Forte de São Francisco; Farol de Olinda",https://antonioaurel.github.io/data/data-visualization/recife-history-connections/pages/sources.html
CH-0138,Fórum Paula Batista,Local,Instituição,Santo Antônio,,"Forum Paula Batista é uma instituição localizada em Santo Antônio, no Recife/Pernambuco. Sua presença na base indica a importância das instituições públicas, assistenciais, administrativas ou de saúde na organização da vida urbana de Pernambuco. O registro aparece associado a Rua do Imperador, Fórum Thomaz de Aquino, Praça da República e Palácio da Justiça, permitindo observar como serviços, órgãos e edifícios institucionais estruturam bairros, fluxos e memórias coletivas. funciona como ponto de ligação entre gestão pública, cotidiano urbano e história social.",Rua do Imperador,Fórum Thomáz de Aquino,Praça da República,Palácio da Justiça,,,,,,,,,,,,"CH-0138 — Fórum Paula Batista
Classificação: Local / Instituição / Santo Antônio
Descrição: Forum Paula Batista é uma instituição localizada em Santo Antônio, no Recife/Pernambuco. Sua presença na base indica a importância das instituições públicas, assistenciais, administrativas ou de saúde na organização da vida urbana de Pernambuco. O registro aparece associado a Rua do Imperador, Fórum Thomaz de Aquino, Praça da República e Palácio da Justiça, permitindo observar como serviços, órgãos e edifícios institucionais estruturam bairros, fluxos e memórias coletivas. funciona como ponto de ligação entre gestão pública, cotidiano urbano e história social.
Interconexões: Rua do Imperador; Fórum Thomáz de Aquino; Praça da República; Palácio da Justiça",https://antonioaurel.github.io/data/data-visualization/recife-history-connections/pages/sources.html
CH-0139,Fórum Thomáz de Aquino,Local,Instituição,São José,,"Fórum Thomaz de Aquino é uma instituição localizada em São José, no Recife/Pernambuco. Sua presença na base indica a importância das instituições públicas, assistenciais, administrativas ou de saúde na organização da vida urbana de Pernambuco. O registro aparece associado a Rua do Imperador, Palácio da Justiça, Praça Dezessete, Forum Paula Batista, Praça da República e Fórum Thomaz de Aquino, permitindo observar como serviços, órgãos e edifícios institucionais estruturam bairros, fluxos e memórias coletivas. funciona como ponto de ligação entre gestão pública, cotidiano urbano e história social.",Rua do Imperador,Palácio da Justiça,Praça Dezessete,Fórum Paula Batista,Praça da República,,,,,,,,,,,"CH-0139 — Fórum Thomáz de Aquino
Classificação: Local / Instituição / São José
Descrição: Fórum Thomaz de Aquino é uma instituição localizada em São José, no Recife/Pernambuco. Sua presença na base indica a importância das instituições públicas, assistenciais, administrativas ou de saúde na organização da vida urbana de Pernambuco. O registro aparece associado a Rua do Imperador, Palácio da Justiça, Praça Dezessete, Forum Paula Batista, Praça da República e Fórum Thomaz de Aquino, permitindo observar como serviços, órgãos e edifícios institucionais estruturam bairros, fluxos e memórias coletivas. funciona como ponto de ligação entre gestão pública, cotidiano urbano e história social.
Interconexões: Rua do Imperador; Palácio da Justiça; Praça Dezessete; Fórum Paula Batista; Praça da República",https://antonioaurel.github.io/data/data-visualization/recife-history-connections/pages/sources.html
CH-0140,Francisco Brennand,Personagem,,,,"Francisco Brennand foi artista plástico, ceramista, escultor e pintor pernambucano, um dos nomes mais reconhecidos da arte brasileira contemporânea. Sua obra criou um universo visual próprio, profundamente ligado ao barro, ao fogo, à mitologia, à sexualidade, à paisagem e à cultura de Pernambuco. A Oficina Brennand, no bairro da Várzea, tornou-se um dos principais espaços culturais do Recife. sua presença articula arte, território, patrimônio industrial e imaginação simbólica, conectando a cidade a uma produção artística de projeção nacional e internacional.",Oficina Brennand,Instituto Ricardo Brennand,Marco Zero,Parque das Esculturas,,,,,,,,,,,,"CH-0140 — Francisco Brennand
Classificação: Personagem
Descrição: Francisco Brennand foi artista plástico, ceramista, escultor e pintor pernambucano, um dos nomes mais reconhecidos da arte brasileira contemporânea. Sua obra criou um universo visual próprio, profundamente ligado ao barro, ao fogo, à mitologia, à sexualidade, à paisagem e à cultura de Pernambuco. A Oficina Brennand, no bairro da Várzea, tornou-se um dos principais espaços culturais do Recife. sua presença articula arte, território, patrimônio industrial e imaginação simbólica, conectando a cidade a uma produção artística de projeção nacional e internacional.
Interconexões: Oficina Brennand; Instituto Ricardo Brennand; Marco Zero; Parque das Esculturas",https://antonioaurel.github.io/data/data-visualization/recife-history-connections/pages/sources.html
CH-0141,Francisco do Rego Barros,Personagem,,,,"Francisco do Rego Barros, o Conde da Boa Vista, foi presidente da Província de Pernambuco no século XIX e uma das figuras centrais da modernização urbana do Recife. Sua administração promoveu obras públicas, melhoramentos viários, pontes, espaços de lazer e iniciativas que transformaram a paisagem da cidade. Seu nome aparece associado a ruas, praças, instituições e equipamentos urbanos. conecta-se ao Cemitério de Santo Amaro, à Biblioteca Pública e a outras referências, funcionando como elo entre política provincial, urbanismo e memória administrativa.",Ponte Mauricio de Nassau,Palácio do Campo das Princesas,Teatro Santa Isabel,Biblioteca Pública do Estado de Pernambuco,Cemitério de Santo Amaro,Avenida Conde da Boa Vista,,,,,,,,,,"CH-0141 — Francisco do Rego Barros
Classificação: Personagem
Descrição: Francisco do Rego Barros, o Conde da Boa Vista, foi presidente da Província de Pernambuco no século XIX e uma das figuras centrais da modernização urbana do Recife. Sua administração promoveu obras públicas, melhoramentos viários, pontes, espaços de lazer e iniciativas que transformaram a paisagem da cidade. Seu nome aparece associado a ruas, praças, instituições e equipamentos urbanos. conecta-se ao Cemitério de Santo Amaro, à Biblioteca Pública e a outras referências, funcionando como elo entre política provincial, urbanismo e memória administrativa.
Interconexões: Ponte Mauricio de Nassau; Palácio do Campo das Princesas; Teatro Santa Isabel; Biblioteca Pública do Estado de Pernambuco; Cemitério de Santo Amaro; Avenida Conde da Boa Vista",https://antonioaurel.github.io/data/data-visualization/recife-history-connections/pages/sources.html
CH-0142,Francisco Pessoa de Queiroz,Personagem,,,,"Francisco Pessoa de Queiroz é uma figura associada à memória histórica, política, cultural ou urbana de Pernambuco. Sua trajetória se relaciona a João Pessoa de Queiroz, José Pessoa de Queiroz, Revolução de 30 e João Pessoa, o que indica sua relevância como elo entre biografia individual e memória pública. Seu registro ajuda a explicar como trajetórias pessoais se transformam em nomes de ruas, pontes, praças, instituições, movimentos ou referências culturais. Francisco Pessoa de Queiroz funciona como registro de articulação entre personagens, fatos históricos e espaços da cidade, permitindo visualizar a história de Pernambuco como uma rede de relações.",João Pessoa de Queiroz,José Pessoa de Queiroz,Revolução de 30,João Pessoa,,,,,,,,,,,,"CH-0142 — Francisco Pessoa de Queiroz
Classificação: Personagem
Descrição: Francisco Pessoa de Queiroz é uma figura associada à memória histórica, política, cultural ou urbana de Pernambuco. Sua trajetória se relaciona a João Pessoa de Queiroz, José Pessoa de Queiroz, Revolução de 30 e João Pessoa, o que indica sua relevância como elo entre biografia individual e memória pública. Seu registro ajuda a explicar como trajetórias pessoais se transformam em nomes de ruas, pontes, praças, instituições, movimentos ou referências culturais. Francisco Pessoa de Queiroz funciona como registro de articulação entre personagens, fatos históricos e espaços da cidade, permitindo visualizar a história de Pernambuco como uma rede de relações.
Interconexões: João Pessoa de Queiroz; José Pessoa de Queiroz; Revolução de 30; João Pessoa",https://antonioaurel.github.io/data/data-visualization/recife-history-connections/pages/sources.html
CH-0143,Francisco Paes Barreto,Personagem,,,,"Frascisco Paes Barreto é uma figura associada à memória histórica, política, cultural ou urbana de Pernambuco. Sua trajetória se relaciona a Revolução de 1817 e Confederação do Equador, o que indica sua relevância como elo entre biografia individual e memória pública. Seu registro ajuda a explicar como trajetórias pessoais se transformam em nomes de ruas, pontes, praças, instituições, movimentos ou referências culturais. Frascisco Paes Barreto funciona como registro de articulação entre personagens, fatos históricos e espaços da cidade, permitindo visualizar a história de Pernambuco como uma rede de relações.",Revolução Pernambucana de 1817,Confederação do Equador,,,,,,,,,,,,,,"CH-0143 — Francisco Paes Barreto
Classificação: Personagem
Descrição: Frascisco Paes Barreto é uma figura associada à memória histórica, política, cultural ou urbana de Pernambuco. Sua trajetória se relaciona a Revolução de 1817 e Confederação do Equador, o que indica sua relevância como elo entre biografia individual e memória pública. Seu registro ajuda a explicar como trajetórias pessoais se transformam em nomes de ruas, pontes, praças, instituições, movimentos ou referências culturais. Frascisco Paes Barreto funciona como registro de articulação entre personagens, fatos históricos e espaços da cidade, permitindo visualizar a história de Pernambuco como uma rede de relações.
Interconexões: Revolução Pernambucana de 1817; Confederação do Equador",https://antonioaurel.github.io/data/data-visualization/recife-history-connections/pages/sources.html
CH-0144,Frei Caneca,Personagem,,,,"Frei Joaquim do Amor Divino Caneca, nascido Joaquim da Silva Rabelo (Recife, 1779 - Recife, 1825), foi um frade carmelita, professor, jornalista e revolucionário pernambucano. Fundou e dirigiu o jornal Typhis Pernambucano (1823) e foi um dos principais líderes da Confederação do Equador, movimento separatista e republicano de 1824 em Pernambuco. Após a derrota do movimento, foi preso e executado por fuzilamento no Recife em janeiro de 1825, depois que carrascos se recusaram a enforcá-lo.",Arsenal da Marinha,Confederação do Equador,Forte das Cinco Pontas,Praça do Carmo,Monumento a Frei Caneca,,,,,,,,,,,"CH-0144 — Frei Caneca
Classificação: Personagem
Descrição: Frei Joaquim do Amor Divino Caneca, nascido Joaquim da Silva Rabelo (Recife, 1779 - Recife, 1825), foi um frade carmelita, professor, jornalista e revolucionário pernambucano. Fundou e dirigiu o jornal Typhis Pernambucano (1823) e foi um dos principais líderes da Confederação do Equador, movimento separatista e republicano de 1824 em Pernambuco. Após a derrota do movimento, foi preso e executado por fuzilamento no Recife em janeiro de 1825, depois que carrascos se recusaram a enforcá-lo.
Interconexões: Arsenal da Marinha; Confederação do Equador; Forte das Cinco Pontas; Praça do Carmo; Monumento a Frei Caneca",https://antonioaurel.github.io/data/data-visualization/recife-history-connections/pages/sources.html
